<?xml version="1.0" encoding="UTF-8"?>
<!DOCTYPE projectDescription SYSTEM "proyectoeclipse.dtd">
<projectDescription>
	<name>UT5Clases</name>
	<comment></comment>
	<projects>
	</projects>
	<buildSpec>
		<buildCommand>
			<name>org.eclipse.jdt.core.javabuilder</name>
			<arguments>
			</arguments>
		</buildCommand>
	</buildSpec>
	<natures>
		<nature>org.eclipse.jdt.core.javanature</nature>
	</natures>
</projectDescription>